S3. Modelado_Machine_Learning/3. Modelado_No_Supervisado_Clustering/resultados/resumen_clusters.csv

cluster,total_registros,porcentaje_cancelacion,lead_time_promedio,adr_promedio,noches_promedio,huespedes_promedio,solicitudes_promedio,cambios_promedio,cancelaciones_previas_promedio,porcentaje_registros
0,18830,13.887413701540098,44.7676048858205,95.69965693043017,2.8375995751460437,1.798088157195964,0.48252788104089217,0.4340414232607541,0.09314922995220393,21.55202014421426
1,68540,31.23577473008462,89.56682229355121,109.27206288298804,3.8492850889991246,2.0879194630872484,0.7580099212138897,0.22706448789028305,0.013189378465129851,78.44797985578575

S3. Flujo_de_trabajo_para_ML/3. Modelado no supervisado (Clustering)/1_resultados/Readme.md

## Interpretacion de patrones encontrados

- Cluster 0: 18830 registros (21.55%). Cancelacion promedio 13.89%, anticipacion 44.77 dias, ADR 95.7, noches 2.84. Predominan hotel Resort Hotel, segmento Direct y cliente Transient.
- Cluster 1: 68540 registros (78.45%). Cancelacion promedio 31.24%, anticipacion 89.57 dias, ADR 109.27, noches 3.85. Predominan hotel City Hotel, segmento Online TA y cliente Transient.